text,filename,voice,exaggeration,cfg_weight,temperature
"Let’s be honest. Your GitHub portfolio looks like a graveyard of half-finished to-do list apps, a weather widget that crashes when it rains, and a calculator that can’t even divide by zero without having an existential crisis. You clicked on this video because you are tired of building garbage. You are tired of ""Hello World"" being the peak of your engineering career. You know you can build an e-commerce store, but so can a twelve-year-old with a Shopify trial. That is not engineering; that is data entry with extra steps. It is honestly a massive insult to the vast, chaotic, and beautiful field of computer science.",001-segment-01,wired-eliv3,0.60,0.45,0.75
"So, for this video, we are throwing the ""beginner friendly"" rulebook into the incinerator. I have set up three criteria for a project to actually be worth your time. One, it must be unique and entertaining enough that you don't fall asleep while coding it. Two, it must teach you a new, terrifying aspect of computer science that makes you question your life choices. And three, it must make recruiters look at your resume and actually feel something other than deep despair. We are going from easier projects to ""I hope you like reading documentation at 3 AM"" difficulty. And just to keep you on your toes, I have hidden some spicy bonus projects along the way that might technically be legal gray areas, but we don't snitch here at WiredWorkshop.",002-segment-02,wired-eliv3,0.58,0.40,0.70
"Let’s start with something visual. Let’s build a Live DDoS Attack Map. Every single second on this planet, hundreds of Denial of Service attacks erupt across the globe like digital pimples. You can monitor them. Literally watch the internet burn in real-time. The idea is to periodically fetch traffic trends and attack spikes from data sources like Cloudflare or abuse IP databases. You classify the IPs with a high attack confidence score using a machine learning model because if you aren't using AI, are you even coding in 2024? You map those remote IPs to geographical coordinates and showcase them using a WebGL globe. For the backend, FastAPI is a no-brainer because we want speed, not a headache. This project proves you understand networking, APIs, and data visualization, and it looks like something out of a hacker movie, which is the only metric that truly matters.",003-segment-03,wired-eliv3,0.58,0.40,0.80
"At number two, let’s solve a societal collapse. We have a solution against the worldwide loneliness pandemic. An eighty-year ongoing study at Harvard shows that real-world friendships are the number one predictor of long-term happiness, yet we are all sitting inside writing code to talk to computers. So, build ""UnAlone."" It is a free app that lets local users find a place and time to hang out. But do not be fooled; this is not just a chat app. Under the hood, this is a geospatial nightmare. You need users to instantly see nearby hotspots where people are planning to hang out. You need real-time chat rooms powered by WebSockets. You need a trust system to prevent scams, which means implementing serious user verification and language filters. My recommended tech stack would be React Native for the frontend because we are lazy, Go for the backend because we want concurrency, and Redis for caching because nobody likes waiting. This proves you can build a scalable, full-stack application that actually interacts with the physical world.",004-segment-04,wired-eliv3,0.60,0.45,0.75
"But why would I go outside to meet people when I can stay inside and watch movies? Oh wait, the next season of my favorite show is geo-locked, and the streaming service I pay for is showing me ads. This is unacceptable. So, project number three is a Network-wide Ad Blocker plus VPN. We are not talking about a browser extension. We are talking about nuking ads from orbit for your entire house. First, check if your Wi-Fi router can be flashed with OpenWRT. If not, grab a Raspberry Pi. You are going to use Pi-hole or AdGuard Home to create a DNS sinkhole. Basically, when your smart fridge tries to load an ad, your Pi-hole looks at the request and says, ""No,"" and sends it into a black hole. Combine this with a WireGuard VPN server so you can access your clean, ad-free home network from anywhere in the world. This project teaches you about DNS, networking, tunneling, and Linux administration. Plus, it saves you from seeing ads for mobile games you will never play.",005-segment-05,wired-eliv3,0.58,0.40,0.70
"Speaking of Linux, here is a bonus project. Learn Linux. And I don't mean just installing Ubuntu and calling it a day. I mean ""ricing."" Customize your desktop environment until it is unrecognizable. Use a window manager like i3 or Hyprland. Write Bash scripts to automate your entire existence. Configure your own package manager. If you are feeling brave, build your own Linux distribution from scratch. This isn't just about looking cool; it’s about understanding the operating system at a fundamental level. You will learn about kernels, drivers, and why people on Reddit are so angry about systemd.",006-segment-06,wired-eliv3,0.58,0.40,0.80
"But maybe you prefer web technologies. Let’s build a Shazam clone. This twenty-three-year-old technology is essentially a fingerprint database for songs, and it is pure magic. It is a perfect crossover of mathematics, signal processing, and web development. You need to record audio, visualize it as a spectrogram, and then use an algorithm to find the ""peaks"" of intensity. You hash these peaks to create a fingerprint and match it against a database. If you are interested in the intersection of computer science and audio engineering, this is the startup project for you. It requires understanding Fourier Transforms, which sounds scary because it is math, but there are Python libraries like Librosa that do the heavy lifting. Demoing this to a recruiter proves you aren't just a ""div centering"" specialist; you are an engineer.",007-segment-07,wired-eliv3,0.60,0.45,0.75
"Now, let's talk about navigation. Google Maps is great, but it is bloated, slow, and tracks your every move. So, let’s build a lightweight, privacy-focused Navigation App. The goal is lightning speed and zero bloatware. You enter a destination, and it just works. You will use OpenStreetMap for the data because open source is king. For the backend routing, you could write your own implementation of Dijkstra’s algorithm or A-Star search, but if you value your sanity, you might look at engines like OSRM or GraphHopper. The challenge here is optimization. You need to cache routes locally so the app works when the user has zero signal in the middle of nowhere. This project forces you to think about graph theory, offline-first architecture, and mobile performance optimization.",008-segment-08,wired-eliv3,0.58,0.40,0.70
"Let’s ramp up the difficulty. How about a Neural Network that learns to play your game? Make a simple game using JavaScript and HTML Canvas. Maybe a car racing game or a clone of Flappy Bird. Then, instead of playing it yourself, you build an AI to beat it. You don't need a massive GPU cluster for this. You can write a simple genetic algorithm or a neural network from scratch in JavaScript. The network takes inputs like ""distance to obstacle"" and outputs ""jump"" or ""do nothing."" At first, your AI will be incredibly stupid and die immediately. But over thousands of generations, it evolves. It learns. Eventually, it destroys your high score and you realize you have created a monster. This is a fantastic introduction to machine learning that is actually visual and fun, rather than just staring at a spreadsheet of accuracy percentages.",009-segment-09,wired-eliv3,0.58,0.40,0.80
"Now for a spicy bonus project. If you hate studying for your college exams, you can use ChatGPT inside your calculator. Disclaimer: Do not actually use this to cheat, or if you do, don't tell them I sent you. You sneak an ESP32 microcontroller inside a standard scientific calculator. You wire it to the keyboard matrix so the ESP32 can read your keystrokes. You type a question, the ESP32 sends it over Wi-Fi to a server, the server asks ChatGPT, and sends the answer back to display on the calculator screen. This is a hardware hacking masterclass. You learn about soldering, PCB reverse engineering, Wi-Fi protocols on microcontrollers, and serial communication. It is James Bond level stuff, and honestly, if you can build this, you deserve the degree anyway.",010-segment-10,wired-eliv3,0.60,0.45,0.75
"Let’s get back to infrastructure. Every programmer needs to try this at least once: A Self-Hosted Personal Cloud. Stop giving Google or Dropbox your money. Take an old laptop or a Raspberry Pi, install a Linux server, and run Nextcloud or OwnCloud. You can create an admin account and unlock terabytes of storage for the cost of the hard drive. You will learn about port forwarding, SSL certificates, Docker containers, and automated backups. You are essentially becoming your own ISP and system administrator. If you want to take it a step further, build your own voice assistant. A DIY Alexa. Use Python libraries like Vosk or Mozilla DeepSpeech for offline voice recognition. You can make it respond to ""Hey Jarvis"" or ""Hey Computer."" Hook it up to a speaker and an API to fetch the weather, play music, or tell you dark jokes. It costs about fifty bucks and provides endless dopamine.",011-segment-11,wired-eliv3,0.58,0.40,0.70
"If you are a masochist who loves low-level programming, try building a Transpiler. Create a toy programming language that compiles into Python or C. You will learn about lexers, parsers, abstract syntax trees, and code generation. Your language can have the most cursed syntax imaginable. You will have to write a tokenizer that breaks text into meaningful chunks, a parser that understands the grammar, and a generator that spits out working code. This is how you bridge the gap between ""coding"" and ""computer science."" It turns the black box of the compiler into something you actually understand.",012-segment-12,wired-eliv3,0.58,0.40,0.80
"But maybe you want to hurt your brain even more. Let’s talk about an Algorithm Visualizer. This looks simple, but it is deceptively hard. You want a web app that visualizes sorting algorithms or pathfinding algorithms in real-time. You need to handle the state of the array frame-by-frame, allow the user to change speed, and render it all on an HTML Canvas without lagging the browser. It forces you to understand the algorithms so deeply that you can break them down into visual steps. If you can build this, you will never fail a technical interview again.",013-segment-13,wired-eliv3,0.60,0.45,0.75
"And speaking of interviews, you need a portfolio. But not a boring Squarespace site. Build a Terminal-based Portfolio. Make your website look and act like a Linux terminal. The user has to type ls to see your projects and cat about.txt to read your bio. It filters out the non-technical recruiters immediately and impresses the ones who actually matter. Or, go even deeper and make a Terminal Game. No graphics libraries. No Unity. Just you, the command line, and ASCII characters. You have to handle rendering loops, input buffers, and collision detection using nothing but text. It forces you to think about game loops and memory management in a raw, unadulterated way. Write it in Rust if you want to be modern, or C if you want to suffer.",014-segment-14,wired-eliv3,0.58,0.40,0.70
"Now, for the god-tier projects. If you pull one of these off, you are a certified legend. As a music producer, I love the idea of a Music Recommendation Engine based on audio analysis, not popularity. Most algorithms just say ""People who liked X also liked Y."" That is boring. I want an engine that analyzes the BPM, the chord progression, the frequency spectrum, and the timbre of the instruments. It clusters songs that sound mathematically similar. This requires deep learning, audio feature extraction, and vector databases. It is a massive project, but the result is a tool that finds hidden gems rather than just playing the Top 40.",015-segment-15,wired-eliv3,0.58,0.40,0.80
"Or, take it a step further. A Domain Specific Language for Music. Write code that compiles into sound. You make functions to import samples, synthesize waveforms, and sequence beats. You are essentially building a DAW (Digital Audio Workstation) that runs on code.",016-segment-16,wired-eliv3,0.60,0.45,0.75
"And finally, the boss battle. A Shader Language Compiler. You have seen those insane graphical demos on ShaderToy? They run on GLSL. What if you built your own shading language that compiles down to GLSL? You would need to understand GPU pipelines, linear algebra, and vector math at a level that would make a math professor sweat. This is not an intermediate project. This is a ""I want to work at NVIDIA"" project. But if you can pull off even a prototype, you are legally allowed to call yourself a wizard.",017-segment-17,wired-eliv3,0.58,0.40,0.70
"If you made it this far, you have zero excuses to be bored. These aren't tutorial copy-paste projects. These are challenges. They are complex, they are frustrating, and they are exactly what you need to stop being a code monkey and start being an engineer. Pick one. Build it. Break it. Fix it. Then come join the WiredWorkshop server and show it off so we can roast your code quality. Thanks for watching, and remember: if your code compiles on the first try, something is definitely wrong.",018-segment-18,wired-eliv3,0.58,0.40,0.80
