text,filename,voice,exaggeration,cfg_weight,temperature
Hey! Welcome back — let's kick this off with a smile.,eli_funny_001,eli-funny,,,
Quick question: are you ready to level up today?,eli_question_001,eli-question,,,
Let's get to work. Clear, steady, and confident.,eli_neutral_001,eli-neutral,,,
Okay, now push it a little — brighter and more upbeat.,eli_funny_002,eli-funny,,,
Hmm, interesting… what would happen if we tried the opposite?,eli_question_002,eli-question,,,
Wrapping up with a neutral take for safety.,eli_neutral_002,eli-neutral,,,

